{
  "finding_id": "F-001",
  "severity": "major",
  "criterion_ids": ["R-001.C1"],
  "location": {"path": "main.go", "line_start": 12, "line_end": 18},
  "defect_scenario": "Running with --version and an extra argument prints the version and continues instead of exiting.",
  "expected_fix": "Return after printing the version regardless of remaining arguments.",
  "evidence_refs": ["reviews/r1/repro.txt"]
}
